date,published_at,source,stock,keyword,title,summary,url,is_sector_news
2024-09-17,| 17 September 2024,Kontan,BBCA,bank big cap,Ekspektasi Pemangkasan Suku Bunga The Fed Jadi Angin Segar Bagi Saham Bank,,https://www.kontan.co.id//keuangan.kontan.co.id/news/ekspektasi-pemangkasan-suku-bunga-the-fed-jadi-angin-segar-bagi-saham-bank,1
2024-09-26,| 26 September 2024,Kontan,BBCA,bank big cap,"Saham-Saham Bank BUMN Turun, Begini Peta Saham Big Cap per Rabu (25/9)",,https://www.kontan.co.id//pusatdata.kontan.co.id/news/saham-saham-bank-bumn-turun-begini-peta-saham-big-cap-per-rabu-259-1,1
2024-09-26,| 26 September 2024,Kontan,BBCA,bank big cap,Tiga Saham Bank Ini Punya Bobot Terbesar pada IHSG,,https://www.kontan.co.id//pusatdata.kontan.co.id/news/tiga-saham-bank-ini-punya-bobot-terbesar-pada-ihsg,1
2024-12-13,| 13 Desember 2024,Kontan,BBCA,bank big cap,"IHSG Terseret Saham Bank yang Dijual Asing, Intip Posisi Terakhir Saham-Saham Big Cap",,https://www.kontan.co.id//pusatdata.kontan.co.id/news/ihsg-terseret-saham-bank-yang-dijual-asing-intip-posisi-terakhir-saham-saham-big-cap,1
2024-12-31,| 31 Desember 2024,Kontan,BBCA,bank big cap,"Cek Pergerakan Top 10 Big Cap di Tahun 2024: BREN Melejit, Laju Saham Bank Melambat",,https://www.kontan.co.id//investasi.kontan.co.id/news/cek-pergerakan-top-10-big-cap-di-tahun-2024-bren-melejit-laju-saham-bank-melambat,1
