date,published_at,source,stock,title,summary,raw_text,clean_text,tokens,stemmed_text,url,sentiment_score,sentiment_label,raw_sentiment_score
2024-04-07,2 tahun yang lalu,CNBC Indonesia,BBCA,"Perbandingan Cuan Investasi, Emas atau Bitcoin Siapa Juara?",,"Perbandingan Cuan Investasi, Emas atau Bitcoin Siapa Juara?",perbandingan cuan investasi emas atau bitcoin siapa juara,perbandingan cuan investasi emas bitcoin juara,banding cuan investasi emas bitcoin juara,https://www.cnbcindonesia.com/mymoney/20240407182438-72-529226/perbandingan-cuan-investasi-emas-atau-bitcoin-siapa-juara,3.0,positif,3
2024-04-08,08 April 2024,Kontan,BBRI,Sabrina dari BRI Siap Memberikan Info Rest Area Hingga ATM Saat Mudik,,Sabrina dari BRI Siap Memberikan Info Rest Area Hingga ATM Saat Mudik,sabrina dari bri siap memberikan info rest area hingga atm saat mudik,sabrina bri info rest area atm mudik,sabrina bri info rest area atm mudik,https://keuangan.kontan.co.id/news/sabrina-dari-bri-siap-memberikan-info-rest-area-hingga-atm-saat-mudik,-3.0,negatif,-6
2024-04-09,09 April 2024,Kontan,BBRI,"Mudik Tanpa Ribet Pakai BRIZZI dari BRI, Begini Cara Top Upnya",,"Mudik Tanpa Ribet Pakai BRIZZI dari BRI, Begini Cara Top Upnya",mudik tanpa ribet pakai brizzi dari bri begini cara top upnya,mudik ribet pakai brizzi bri top upnya,mudik ribet pakai brizzi bri top upnya,https://keuangan.kontan.co.id/news/mudik-tanpa-ribet-pakai-brizzi-dari-bri-begini-cara-top-upnya,-0.6666666666666666,negatif,-2
2024-04-11,11 April 2024,Kontan,BBCA,Menghitung Cuan Perbankan dari Dividen Anak Usaha Multifinance,,Menghitung Cuan Perbankan dari Dividen Anak Usaha Multifinance,menghitung cuan perbankan dari dividen anak usaha multifinance,menghitung cuan perbankan dividen anak usaha multifinance,hitung cuan perban dividen anak usaha multifinance,https://keuangan.kontan.co.id/news/menghitung-cuan-perbankan-dari-dividen-anak-usaha-multifinance,-1.0,negatif,-4
2024-04-13,13 April 2024,Kontan,BBRI,Manfaatkan Layanan Asuransi Griya Proteksi Maksima BRI untuk Jaga Nilai Properti,,Manfaatkan Layanan Asuransi Griya Proteksi Maksima BRI untuk Jaga Nilai Properti,manfaatkan layanan asuransi griya proteksi maksima bri untuk jaga nilai properti,manfaatkan layanan asuransi griya proteksi maksima bri jaga nilai properti,manfaat layan asuransi griya proteksi maksima bri jaga nilai properti,https://keuangan.kontan.co.id/news/manfaatkan-layanan-asuransi-griya-proteksi-maksima-bri-untuk-jaga-nilai-properti,2.6,positif,13
2024-04-14,14 April 2024,Kontan,BBRI,"Arus Balik Lebaran, BRI Hadirkan Posko BRImo di Beberapa Rute Ini",,"Arus Balik Lebaran, BRI Hadirkan Posko BRImo di Beberapa Rute Ini",arus balik lebaran bri hadirkan posko brimo di beberapa rute ini,arus lebaran bri hadirkan posko brimo rute,arus lebaran bri hadir posko brimo rute,https://keuangan.kontan.co.id/news/arus-balik-lebaran-bri-hadirkan-posko-brimo-di-beberapa-rute-ini,2.0,positif,4
2024-04-16,16 April 2024,Kontan,BBRI,"Harga Saham Perbankan Rontok, Muncul Transaksi Negosiasi Saham BBRI Rp 1,2 Triliun",,"Harga Saham Perbankan Rontok, Muncul Transaksi Negosiasi Saham BBRI Rp 1,2 Triliun",harga saham perbankan rontok muncul transaksi negosiasi saham bbri rp triliun,harga saham perbankan rontok muncul transaksi negosiasi saham bbri rp triliun,harga saham perban rontok muncul transaksi negosiasi saham bbri rp triliun,https://insight.kontan.co.id/news/harga-saham-perbankan-rontok-muncul-transaksi-negosiasi-saham-bbri-rp-12-triliun,1.3333333333333333,positif,8
2024-04-16,2 tahun yang lalu,CNBC Indonesia,BBCA,"Saham Perbankan RI Ambruk Berjamaah, Ada Apa?",,"Saham Perbankan RI Ambruk Berjamaah, Ada Apa?",saham perbankan ri ambruk berjamaah ada apa,saham perbankan ri ambruk berjamaah,saham perban ri ambruk jamaah,https://www.cnbcindonesia.com/market/20240416090452-17-530557/saham-perbankan-ri-ambruk-berjamaah-ada-apa,-4.0,negatif,-8
2024-04-16,2 tahun yang lalu,CNBC Indonesia,BBCA,"Saham Bank RI Ambruk Karena Konflik Iran-Israel, Kinerjanya Masih OK?",,"Saham Bank RI Ambruk Karena Konflik Iran-Israel, Kinerjanya Masih OK?",saham bank ri ambruk karena konflik iran israel kinerjanya masih ok,saham bank ri ambruk konflik iran israel kinerjanya ok,saham bank ri ambruk konflik iran israel kerja ok,https://www.cnbcindonesia.com/research/20240416155913-128-530743/saham-bank-ri-ambruk-karena-konflik-iran-israel-kinerjanya-masih-ok,0.3333333333333333,positif,1
2024-04-16,2 tahun yang lalu,CNBC Indonesia,BBCA,"Terbaru! Ini Daftar 20 Bank Raksasa di Asia, Ada BRI dan BCA!",,"Terbaru! Ini Daftar 20 Bank Raksasa di Asia, Ada BRI dan BCA!",terbaru ini daftar bank raksasa di asia ada bri dan bca,terbaru daftar bank raksasa asia bri bca,baru daftar bank raksasa asia bri bca,https://www.cnbcindonesia.com/research/20240416114814-128-530643/terbaru-ini-daftar-20-bank-raksasa-di-asia-ada-bri-dan-bca,1.0,positif,1
2024-04-17,17 April 2024,Kontan,BBRI,Bersantap Steak Lebih Hemat dengan Promo BRI di Wolfgang dan Butler’s,,Bersantap Steak Lebih Hemat dengan Promo BRI di Wolfgang dan Butler’s,bersantap steak lebih hemat dengan promo bri di wolfgang dan butler s,bersantap steak hemat promo bri wolfgang butler,santap steak hemat promo bri wolfgang butler,https://keuangan.kontan.co.id/news/bersantap-steak-lebih-hemat-dengan-promo-bri-di-wolfgang-dan-butlers,3.5,positif,7
2024-04-17,2 tahun yang lalu,CNBC Indonesia,BBCA,"Rupiah Kembali Ambruk, Segini Kurs Dolar di BCA, Mandiri Hingga UOB",,"Rupiah Kembali Ambruk, Segini Kurs Dolar di BCA, Mandiri Hingga UOB",rupiah kembali ambruk segini kurs dolar di bca mandiri hingga uob,rupiah ambruk segini kurs dolar bca mandiri uob,rupiah ambruk gin kurs dolar bca mandiri uob,https://www.cnbcindonesia.com/market/20240417101214-17-530936/rupiah-kembali-ambruk-segini-kurs-dolar-di-bca-mandiri-hingga-uob,-4.0,negatif,-8
2024-04-18,2 tahun yang lalu,CNBC Indonesia,BBCA,Borong! Ini 4 Saham Mercy Harga Bajaj: Ada BCA,,Borong! Ini 4 Saham Mercy Harga Bajaj: Ada BCA,borong ini saham mercy harga bajaj ada bca,borong saham mercy harga bajaj bca,borong saham mercy harga bajaj bca,https://www.cnbcindonesia.com/research/20240418125714-128-531311/borong-ini-4-saham-mercy-harga-bajaj-ada-bca,2.5,positif,5
2024-04-18,18 April 2024,Kontan,BBCA,"Harga Melonjak, Market Cap BREN Kian Mendekati BBCA",,"Harga Melonjak, Market Cap BREN Kian Mendekati BBCA",harga melonjak market cap bren kian mendekati bbca,harga melonjak market cap bren kian mendekati bbca,harga lonjak market cap bren kian dekat bbca,https://insight.kontan.co.id/news/harga-melonjak-market-cap-bren-kian-mendekati-bbca,2.0,positif,4
2024-04-18,18 April 2024,Kontan,BBRI,"Transfer Tanpa Ribet Hafal Nomor Rekening, Pakai Nama Alias dan QRIS di BRImo",,"Transfer Tanpa Ribet Hafal Nomor Rekening, Pakai Nama Alias dan QRIS di BRImo",transfer tanpa ribet hafal nomor rekening pakai nama alias dan qris di brimo,transfer ribet hafal nomor rekening pakai nama alias qris brimo,transfer ribet hafal nomor rekening pakai nama alias qris brimo,https://keuangan.kontan.co.id/news/transfer-tanpa-ribet-hafal-nomor-rekening-pakai-nama-alias-dan-qris-di-brimo,-4.0,negatif,-4
2024-04-18,2 tahun yang lalu,CNBC Indonesia,BBCA,"Video: Menanti Roadmap Industri, Begini Harapan Pelaku Dapen!",,"Video: Menanti Roadmap Industri, Begini Harapan Pelaku Dapen!",video menanti roadmap industri begini harapan pelaku dapen,video roadmap industri harapan pelaku dapen,video roadmap industri harap laku dapen,https://www.cnbcindonesia.com/mymoney/20240418183226-74-531471/video-menanti-roadmap-industri-begini-harapan-pelaku-dapen,3.0,positif,3
2024-04-18,2 tahun yang lalu,CNBC Indonesia,BBCA,"Rupiah Menguat, Cek Kurs Dolar AS di BCA, BNI, Hingga UOB!",,"Rupiah Menguat, Cek Kurs Dolar AS di BCA, BNI, Hingga UOB!",rupiah menguat cek kurs dolar as di bca bni hingga uob,rupiah menguat cek kurs dolar as bca bni uob,rupiah kuat cek kurs dolar as bca bni uob,https://www.cnbcindonesia.com/market/20240418100553-17-531235/rupiah-menguat-cek-kurs-dolar-as-di-bca-bni-hingga-uob,-1.0,negatif,-2
2024-04-19,19 April 2024,Kontan,BBCA,Bank DKI Jadi BUMD Penyumbang Dividen Terbesar Bagi Pemprov DKI Jakarta,,Bank DKI Jadi BUMD Penyumbang Dividen Terbesar Bagi Pemprov DKI Jakarta,bank dki jadi bumd penyumbang dividen terbesar bagi pemprov dki jakarta,bank dki bumd penyumbang dividen terbesar pemprov dki jakarta,bank dki bumd sumbang dividen besar pemprov dki jakarta,https://keuangan.kontan.co.id/news/bank-dki-jadi-bumd-penyumbang-dividen-terbesar-bagi-pemprov-dki-jakarta,0.0,netral,0
2024-04-19,2 tahun yang lalu,CNBC Indonesia,BBCA,Mau Serok Saham Bank yang Lagi Turun? Baca Ini Dulu...,,Mau Serok Saham Bank yang Lagi Turun? Baca Ini Dulu...,mau serok saham bank yang lagi turun baca ini dulu,serok saham bank turun baca,serok saham bank turun baca,https://www.cnbcindonesia.com/mymoney/20240419123947-72-531650/mau-serok-saham-bank-yang-lagi-turun-baca-ini-dulu,2.0,positif,4
2024-04-19,19 April 2024,Kontan,BBRI,BRI Catat Peningkatan Transaksi Brizzi 15% Selama Momen Ramadan dan Lebaran 2024,,BRI Catat Peningkatan Transaksi Brizzi 15% Selama Momen Ramadan dan Lebaran 2024,bri catat peningkatan transaksi brizzi selama momen ramadan dan lebaran,bri catat peningkatan transaksi brizzi momen ramadan lebaran,bri catat tingkat transaksi brizzi momen ramadan lebaran,https://keuangan.kontan.co.id/news/bri-catat-peningkatan-transaksi-brizzi-15-selama-momen-ramadan-dan-lebaran-2024,2.5,positif,5
2024-04-19,19 April 2024,Kontan,BBCA,"Simak Pergerakan Harga Saham INTP, BBCA, dan BBRI di Penutupan Bursa Jumat (19/4)",,"Simak Pergerakan Harga Saham INTP, BBCA, dan BBRI di Penutupan Bursa Jumat (19/4)",simak pergerakan harga saham intp bbca dan bbri di penutupan bursa jumat,simak pergerakan harga saham intp bbca bbri penutupan bursa jumat,simak gera harga saham intp bbca bbri tutup bursa jumat,https://investasi.kontan.co.id/news/simak-pergerakan-harga-saham-intp-bbca-dan-bbri-di-penutupan-bursa-jumat-194-1,1.5,positif,6
2024-04-19,2 tahun yang lalu,CNBC Indonesia,BBCA,"Mau Jadi Nasabah Prioritas BCA, BRI, Mandiri, Segini Saldo Minimalnya",,"Mau Jadi Nasabah Prioritas BCA, BRI, Mandiri, Segini Saldo Minimalnya",mau jadi nasabah prioritas bca bri mandiri segini saldo minimalnya,nasabah prioritas bca bri mandiri segini saldo minimalnya,nasabah prioritas bca bri mandiri gin saldo minimal,https://www.cnbcindonesia.com/market/20240419104605-17-531613/mau-jadi-nasabah-prioritas-bca-bri-mandiri-segini-saldo-minimalnya,0.0,netral,0
2024-04-19,2 tahun yang lalu,CNBC Indonesia,BBCA,"Cek Saldo Minimum BCA, Mandiri, BNI, BRI Terbaru",,"Cek Saldo Minimum BCA, Mandiri, BNI, BRI Terbaru",cek saldo minimum bca mandiri bni bri terbaru,cek saldo minimum bca mandiri bni bri terbaru,cek saldo minimum bca mandiri bni bri baru,https://www.cnbcindonesia.com/market/20240419085618-17-531551/cek-saldo-minimum-bca-mandiri-bni-bri-terbaru,-1.6666666666666667,negatif,-5
2024-04-22,22 April 2024,Kontan,BBCA,"Kredit BCA Tumbuh 17,1% YoY pada Kuartal I-2024, Ini Penopangnya",,"Kredit BCA Tumbuh 17,1% YoY pada Kuartal I-2024, Ini Penopangnya",kredit bca tumbuh yoy pada kuartal i ini penopangnya,kredit bca tumbuh yoy kuartal penopangnya,kredit bca tumbuh yoy kuartal topang,https://keuangan.kontan.co.id/news/kredit-bca-tumbuh-171-yoy-pada-kuartal-i-2024-ini-penopangnya,0.0,netral,0
2024-04-22,2 tahun yang lalu,CNBC Indonesia,BBCA,"BCA Salurkan Kredit Rp 835,7 T, Korporasi Jadi Penopang",,"BCA Salurkan Kredit Rp 835,7 T, Korporasi Jadi Penopang",bca salurkan kredit rp t korporasi jadi penopang,bca salurkan kredit rp korporasi penopang,bca salur kredit rp korporasi topang,https://www.cnbcindonesia.com/market/20240422161329-17-532326/bca-salurkan-kredit-rp-8357-t-korporasi-jadi-penopang,0.0,netral,0
2024-04-22,2 tahun yang lalu,CNBC Indonesia,BBCA,"Jadi Nasabah Prioritas BCA Hingga Mandiri, Ini Layanan Mewahnya",,"Jadi Nasabah Prioritas BCA Hingga Mandiri, Ini Layanan Mewahnya",jadi nasabah prioritas bca hingga mandiri ini layanan mewahnya,nasabah prioritas bca mandiri layanan mewahnya,nasabah prioritas bca mandiri layan mewah,https://www.cnbcindonesia.com/market/20240422120859-17-532222/jadi-nasabah-prioritas-bca-hingga-mandiri-ini-layanan-mewahnya,1.0,positif,3
2024-04-22,2 tahun yang lalu,CNBC Indonesia,BBCA,"Breaking! BCA Raup Laba Rp 12,9 T di Kuartal I-2024, Tumbuh 11,7%",,"Breaking! BCA Raup Laba Rp 12,9 T di Kuartal I-2024, Tumbuh 11,7%",breaking bca raup laba rp t di kuartal i tumbuh,breaking bca raup laba rp kuartal tumbuh,breaking bca raup laba rp kuartal tumbuh,https://www.cnbcindonesia.com/market/20240422151010-17-532299/breaking-bca-raup-laba-rp-129-t-di-kuartal-i-2024-tumbuh-117,4.0,positif,4
2024-04-22,2 tahun yang lalu,CNBC Indonesia,BBCA,Bos BCA Blak-Blakan Ramal Suku Bunga The Fed Susah Turun,,Bos BCA Blak-Blakan Ramal Suku Bunga The Fed Susah Turun,bos bca blak blakan ramal suku bunga the fed susah turun,bos bca blak blakan ramal suku bunga the fed susah turun,bos bca blak blakan ramal suku bunga the fed susah turun,https://www.cnbcindonesia.com/market/20240422175110-17-532391/bos-bca-blak-blakan-ramal-suku-bunga-the-fed-susah-turun,0.4,positif,2
2024-04-22,2 tahun yang lalu,CNBC Indonesia,BBCA,"Bos BCA: Dunia Gak Pasti, Merem Aja Kondisi Berubah",,"Bos BCA: Dunia Gak Pasti, Merem Aja Kondisi Berubah",bos bca dunia gak pasti merem aja kondisi berubah,bos bca dunia gak merem aja kondisi berubah,bos bca dunia gak merem aja kondisi ubah,https://www.cnbcindonesia.com/market/20240422181037-17-532396/bos-bca-dunia-gak-pasti-merem-aja-kondisi-berubah,0.75,positif,3
2024-04-22,2 tahun yang lalu,CNBC Indonesia,BBCA,"Bukan Iran-Israel, Bos BCA Blak-blakan Penyebab Rupiah Ambruk",,"Bukan Iran-Israel, Bos BCA Blak-blakan Penyebab Rupiah Ambruk",bukan iran israel bos bca blak blakan penyebab rupiah ambruk,iran israel bos bca blak blakan penyebab rupiah ambruk,iran israel bos bca blak blakan sebab rupiah ambruk,https://www.cnbcindonesia.com/market/20240422172022-17-532370/bukan-iran-israel-bos-bca-blak-blakan-penyebab-rupiah-ambruk,0.3333333333333333,positif,1
2024-04-22,22 April 2024,Kontan,BBRI,"Market Cap Emiten BUMN Turun, Simak Sentimen dan Prospeknya",,"Market Cap Emiten BUMN Turun, Simak Sentimen dan Prospeknya",market cap emiten bumn turun simak sentimen dan prospeknya,market cap emiten bumn turun simak sentimen prospeknya,market cap emiten bumn turun simak sentimen prospek,https://investasi.kontan.co.id/news/market-cap-emiten-bumn-turun-simak-sentimen-dan-prospeknya,1.0,positif,4
2024-04-23,23 April 2024,Kontan,BBCA,"Saham Perbankan Masih Primadona di Tengah Penurunan IHSG, Simak Rekomendasi Analis",,"Saham Perbankan Masih Primadona di Tengah Penurunan IHSG, Simak Rekomendasi Analis",saham perbankan masih primadona di tengah penurunan ihsg simak rekomendasi analis,saham perbankan primadona tengah penurunan ihsg simak rekomendasi analis,saham perban primadona tengah turun ihsg simak rekomendasi analis,https://investasi.kontan.co.id/news/saham-perbankan-masih-primadona-di-tengah-penurunan-ihsg-simak-rekomendasi-analis,1.6,positif,8
2024-04-23,2 tahun yang lalu,CNBC Indonesia,BBCA,"Diobral Asing, Prospek Saham Big Banks Masih Cerah?",,"Diobral Asing, Prospek Saham Big Banks Masih Cerah?",diobral asing prospek saham big banks masih cerah,diobral asing prospek saham big banks cerah,obral asing prospek saham big banks cerah,https://www.cnbcindonesia.com/research/20240423152548-128-532681/diobral-asing-prospek-saham-big-banks-masih-cerah,0.0,netral,0
2024-04-23,2 tahun yang lalu,CNBC Indonesia,BBCA,"Prabowo Pasti Presiden-Konflik Timteng, Begini Nasib Saham Bank di RI",,"Prabowo Pasti Presiden-Konflik Timteng, Begini Nasib Saham Bank di RI",prabowo pasti presiden konflik timteng begini nasib saham bank di ri,prabowo presiden konflik timteng nasib saham bank ri,prabowo presiden konflik timteng nasib saham bank ri,https://www.cnbcindonesia.com/market/20240423151758-17-532677/prabowo-pasti-presiden-konflik-timteng-begini-nasib-saham-bank-di-ri,3.0,positif,3
2024-04-23,2 tahun yang lalu,CNBC Indonesia,BBCA,"Paylater Tumbuh Pesat, BCA Ungkap Risiko Kredit Tahun Ini",,"Paylater Tumbuh Pesat, BCA Ungkap Risiko Kredit Tahun Ini",paylater tumbuh pesat bca ungkap risiko kredit tahun ini,paylater tumbuh pesat bca risiko kredit tahun,paylater tumbuh pesat bca risiko kredit tahun,https://www.cnbcindonesia.com/market/20240423072002-17-532471/paylater-tumbuh-pesat-bca-ungkap-risiko-kredit-tahun-ini,0.0,netral,0
2024-04-23,2 tahun yang lalu,CNBC Indonesia,BBCA,Bos BCA Sebut Banyak Warga RI Libur ke Luar Negeri Bikin Rupiah Ambruk,,Bos BCA Sebut Banyak Warga RI Libur ke Luar Negeri Bikin Rupiah Ambruk,bos bca sebut banyak warga ri libur ke luar negeri bikin rupiah ambruk,bos bca warga ri libur negeri bikin rupiah ambruk,bos bca warga ri libur negeri bikin rupiah ambruk,https://www.cnbcindonesia.com/market/20240423101805-17-532538/bos-bca-sebut-banyak-warga-ri-libur-ke-luar-negeri-bikin-rupiah-ambruk,0.3333333333333333,positif,1
2024-04-23,2 tahun yang lalu,CNBC Indonesia,BBCA,"BI Intervensi Jaga Rupiah, Bos BCA: Seperti Buang Garam ke Laut",,"BI Intervensi Jaga Rupiah, Bos BCA: Seperti Buang Garam ke Laut",bi intervensi jaga rupiah bos bca seperti buang garam ke laut,bi intervensi jaga rupiah bos bca buang garam laut,bi intervensi jaga rupiah bos bca buang garam laut,https://www.cnbcindonesia.com/market/20240423104432-17-532553/bi-intervensi-jaga-rupiah-bos-bca-seperti-buang-garam-ke-laut,0.6666666666666666,positif,2
2024-04-23,23 April 2024,Kontan,BBRI,"Periksa Harga Saham BUMI, BBRI, dan GOTO di Penutupan Bursa Selasa (23/4)",,"Periksa Harga Saham BUMI, BBRI, dan GOTO di Penutupan Bursa Selasa (23/4)",periksa harga saham bumi bbri dan goto di penutupan bursa selasa,periksa harga saham bumi bbri goto penutupan bursa selasa,periksa harga saham bumi bbri goto tutup bursa selasa,https://investasi.kontan.co.id/news/periksa-harga-saham-bumi-bbri-dan-goto-di-penutupan-bursa-selasa-234,-1.3333333333333333,negatif,-4
2024-04-23,23 April 2024,Kontan,BBRI,Asuransi PIJAR dari BRI Life Berikan Perlindungan Jiwa dengan Premi Terjangkau,,Asuransi PIJAR dari BRI Life Berikan Perlindungan Jiwa dengan Premi Terjangkau,asuransi pijar dari bri life berikan perlindungan jiwa dengan premi terjangkau,asuransi pijar bri life perlindungan jiwa premi terjangkau,asuransi pijar bri life lindung jiwa premi jangkau,https://keuangan.kontan.co.id/news/asuransi-pijar-dari-bri-life-berikan-perlindungan-jiwa-dengan-premi-terjangkau,1.0,positif,2
2024-04-23,2 tahun yang lalu,CNBC Indonesia,BBCA,"Bankir Blak-blakan Rupiah Jatuh Bukan Karena Iran-Israel, Ini Datanya",,"Bankir Blak-blakan Rupiah Jatuh Bukan Karena Iran-Israel, Ini Datanya",bankir blak blakan rupiah jatuh bukan karena iran israel ini datanya,bankir blak blakan rupiah jatuh iran israel datanya,bankir blak blakan rupiah jatuh iran israel data,https://www.cnbcindonesia.com/research/20240423120151-128-532600/bankir-blak-blakan-rupiah-jatuh-bukan-karena-iran-israel-ini-datanya,-1.0,negatif,-2
2024-04-24,2 tahun yang lalu,CNBC Indonesia,BBCA,Cara Menaikkan Limit Kartu Kredit BCA Dengan Cepat,,Cara Menaikkan Limit Kartu Kredit BCA Dengan Cepat,cara menaikkan limit kartu kredit bca dengan cepat,menaikkan limit kartu kredit bca cepat,naik limit kartu kredit bca cepat,https://www.cnbcindonesia.com/market/20240424085310-17-532854/cara-menaikkan-limit-kartu-kredit-bca-dengan-cepat,2.0,positif,4
2024-04-24,2 tahun yang lalu,CNBC Indonesia,BBCA,"BI Rate Naik Jadi 6,25%, Ini Komentar Bankir",,"BI Rate Naik Jadi 6,25%, Ini Komentar Bankir",bi rate naik jadi ini komentar bankir,bi rate komentar bankir,bi rate komentar bankir,https://www.cnbcindonesia.com/market/20240424153822-17-533077/bi-rate-naik-jadi-625-ini-komentar-bankir,0.0,netral,0
2024-04-24,24 April 2024,Kontan,BBRI,"Kerja Sama KPR BRI dan Sinar Mas Land Tawarkan Suku Bunga Mulai Dari 3,25%",,"Kerja Sama KPR BRI dan Sinar Mas Land Tawarkan Suku Bunga Mulai Dari 3,25%",kerja sama kpr bri dan sinar mas land tawarkan suku bunga mulai dari,kpr bri sinar mas land tawarkan suku bunga,kpr bri sinar mas land tawar suku bunga,https://keuangan.kontan.co.id/news/kerja-sama-kpr-bri-dan-sinar-mas-land-tawarkan-suku-bunga-mulai-dari-325,-0.5,negatif,-1
2024-04-24,2 tahun yang lalu,CNBC Indonesia,BBCA,"Amit-Amit BI Rate Naik, Deretan Bisnis Ini Terancam Kredit Macet",,"Amit-Amit BI Rate Naik, Deretan Bisnis Ini Terancam Kredit Macet",amit amit bi rate naik deretan bisnis ini terancam kredit macet,amit amit bi rate deretan bisnis terancam kredit macet,amit amit bi rate deret bisnis ancam kredit macet,https://www.cnbcindonesia.com/research/20240424105431-128-532917/amit-amit-bi-rate-naik-deretan-bisnis-ini-terancam-kredit-macet,-2.25,negatif,-9
2024-04-24,24 April 2024,Kontan,BBCA,Saham Perbankan Masih Jadi Jagoan Analis di Tengah Penurunan IHSG,,Saham Perbankan Masih Jadi Jagoan Analis di Tengah Penurunan IHSG,saham perbankan masih jadi jagoan analis di tengah penurunan ihsg,saham perbankan jagoan analis tengah penurunan ihsg,saham perban jago analis tengah turun ihsg,https://investasi.kontan.co.id/news/saham-perbankan-masih-jadi-jagoan-analis-di-tengah-penurunan-ihsg,0.75,positif,3
2024-04-25,25 April 2024,Kontan,BBRI,Direktur Utama BRI Sunarso Merespons Keputusan Kenaikan Suku Bunga BI,,Direktur Utama BRI Sunarso Merespons Keputusan Kenaikan Suku Bunga BI,direktur utama bri sunarso merespons keputusan kenaikan suku bunga bi,direktur utama bri sunarso merespons keputusan kenaikan suku bunga bi,direktur utama bri sunarso respons putus naik suku bunga bi,https://keuangan.kontan.co.id/news/direktur-utama-bri-sunarso-merespons-keputusan-kenaikan-suku-bunga-bi,2.6,positif,13
2024-04-25,25 April 2024,Kontan,BBRI,"Laba Naik 2,45%, Penyaluran Kredit BRI Naik 10,89% di Kuartal Pertama 2024",,"Laba Naik 2,45%, Penyaluran Kredit BRI Naik 10,89% di Kuartal Pertama 2024",laba naik penyaluran kredit bri naik di kuartal pertama,laba penyaluran kredit bri kuartal,laba salur kredit bri kuartal,https://keuangan.kontan.co.id/news/laba-naik-245-penyaluran-kredit-bri-naik-1089-di-kuartal-pertama-2024,4.0,positif,4
2024-04-25,2 tahun yang lalu,CNBC Indonesia,BBCA,Jenis dan Limit Kartu Kredit BCA,,Jenis dan Limit Kartu Kredit BCA,jenis dan limit kartu kredit bca,jenis limit kartu kredit bca,jenis limit kartu kredit bca,https://www.cnbcindonesia.com/market/20240425085445-17-533266/jenis-dan-limit-kartu-kredit-bca,0.0,netral,0
2024-04-25,2 tahun yang lalu,CNBC Indonesia,BBCA,"Laba BRI Kalahkan BCA, Ini Data Terbarunya",,"Laba BRI Kalahkan BCA, Ini Data Terbarunya",laba bri kalahkan bca ini data terbarunya,laba bri kalahkan bca data terbarunya,laba bri kalah bca data baru,https://www.cnbcindonesia.com/market/20240425093017-17-533291/laba-bri-kalahkan-bca-ini-data-terbarunya,-1.0,negatif,-3
2024-04-25,25 April 2024,Kontan,BBCA,Mewaspadai Potensi Penurunan Laba Perbankan di Kuartal I-2024,,Mewaspadai Potensi Penurunan Laba Perbankan di Kuartal I-2024,mewaspadai potensi penurunan laba perbankan di kuartal i,mewaspadai potensi penurunan laba perbankan kuartal,waspada potensi turun laba perban kuartal,https://insight.kontan.co.id/news/mewaspadai-potensi-penurunan-laba-perbankan-di-kuartal-i-2024,1.6,positif,8
2024-04-25,25 April 2024,Kontan,BBCA,"Saham BBRI, BBCA, BMRI Loyo Pasca Kenaikan BI Rate, Simak Rekomendasi Analis Berikut",,"Saham BBRI, BBCA, BMRI Loyo Pasca Kenaikan BI Rate, Simak Rekomendasi Analis Berikut",saham bbri bbca bmri loyo pasca kenaikan bi rate simak rekomendasi analis berikut,saham bbri bbca bmri loyo pasca kenaikan bi rate simak rekomendasi analis,saham bbri bbca bmri loyo pasca naik bi rate simak rekomendasi analis,https://keuangan.kontan.co.id/news/saham-bbri-bbca-bmri-loyo-pasca-kenaikan-bi-rate-simak-rekomendasi-analis-berikut,2.0,positif,4
2024-04-25,2 tahun yang lalu,CNBC Indonesia,BBCA,"BI Rate 6,25%, Sektor Perbankan Cukup Tangguh?",,"BI Rate 6,25%, Sektor Perbankan Cukup Tangguh?",bi rate sektor perbankan cukup tangguh,bi rate sektor perbankan tangguh,bi rate sektor perban tangguh,https://www.cnbcindonesia.com/research/20240425133538-128-533389/bi-rate-625-sektor-perbankan-cukup-tangguh,1.0,positif,2
2024-04-25,25 April 2024,Kontan,BBRI,"Cek Harga Saham PGEO, AMMN, dan BBRI yang Beda Nasib di Penutupan Bursa Kamis (25/4)",,"Cek Harga Saham PGEO, AMMN, dan BBRI yang Beda Nasib di Penutupan Bursa Kamis (25/4)",cek harga saham pgeo ammn dan bbri yang beda nasib di penutupan bursa kamis,cek harga saham pgeo ammn bbri beda nasib penutupan bursa kamis,cek harga saham pgeo ammn bbri beda nasib tutup bursa kamis,https://investasi.kontan.co.id/news/cek-harga-saham-pgeo-ammn-dan-bbri-yang-beda-nasib-di-penutupan-bursa-kamis-254,-1.25,negatif,-5
2024-04-25,25 April 2024,Kontan,BBCA,"Seiring Agenda Pembagian Dividen, Direktur Hingga Komisaris Borong Saham Bank BJBR",,"Seiring Agenda Pembagian Dividen, Direktur Hingga Komisaris Borong Saham Bank BJBR",seiring agenda pembagian dividen direktur hingga komisaris borong saham bank bjbr,seiring agenda pembagian dividen direktur komisaris borong saham bank bjbr,iring agenda bagi dividen direktur komisaris borong saham bank bjbr,https://insight.kontan.co.id/news/seiring-agenda-pembagian-dividen-direktur-hingga-komisaris-borong-saham-bank-bjbr,2.3333333333333335,positif,7
2024-04-26,26 April 2024,Kontan,BBCA,"Saham BBRI, BBCA, BMRI Turun Pasca Kenaikan BI Rate, Cek Rekomendasi Analis Berikut",,"Saham BBRI, BBCA, BMRI Turun Pasca Kenaikan BI Rate, Cek Rekomendasi Analis Berikut",saham bbri bbca bmri turun pasca kenaikan bi rate cek rekomendasi analis berikut,saham bbri bbca bmri turun pasca kenaikan bi rate cek rekomendasi analis,saham bbri bbca bmri turun pasca naik bi rate cek rekomendasi analis,https://keuangan.kontan.co.id/news/saham-bbri-bbca-bmri-turun-pasca-kenaikan-bi-rate-cek-rekomendasi-analis-berikut,-0.6666666666666666,negatif,-2
